{
  "$schema": "https://schema.tauri.app/capabilities.schema.json",
  "identifier": "default",
  "description": "Capability for the main window",
  "local": true,
  "windows": ["main"],
  "permissions": [
    "core:default",
    "core:event:default",
    "core:webview:default",
    "core:webview:allow-internal-toggle-devtools",
    "core:app:default",
    "core:window:default"
  ]
}
